version_id,scenario_code,scenario_set_code,order_index,scenario_text_en,scenario_text_ar
v2,D03_36,deep_03,36,You have one free hour. What do you choose?,لديك ساعة فراغ. ماذا تختار؟
v2,D03_37,deep_03,37,A community task needs volunteers. What do you do?,مهمة مجتمعية تحتاج متطوعين. ماذا تفعل؟
v2,D03_38,deep_03,38,You want to raise your ambition level. What do you do?,تريد رفع مستوى طموحك. ماذا تفعل؟
v2,D03_39,deep_03,39,Someone thanks you publicly. What do you do?,شخص يشكرك علنًا. ماذا تفعل؟
v2,D03_40,deep_03,40,You’re torn between rest and productivity. What do you do?,أنت ممزق بين الراحة والإنتاجية. ماذا تفعل؟
v2,D03_41,deep_03,41,You notice a friend feels lonely. What do you do?,تلاحظ أن صديقًا يشعر بالوحدة. ماذا تفعل؟
v2,D03_42,deep_03,42,You must deliver results under pressure. What do you do?,يجب أن تسلّم نتائج تحت ضغط. ماذا تفعل؟
v2,D03_43,deep_03,43,You want to increase daily joy. What do you do?,تريد زيادة الفرح اليومي. ماذا تفعل؟
v2,D03_44,deep_03,44,You need to make a personal decision. What guides you?,تحتاج قرارًا شخصيًا. ما الذي يوجهك؟
v2,D03_45,deep_03,45,A safety concern is raised by someone. What do you do?,أثار أحدهم قلقًا يتعلق بالسلامة. ماذا تفعل؟
v2,D03_46,deep_03,46,You want to improve your health this week. What do you start with?,تريد تحسين صحتك هذا الأسبوع. بماذا تبدأ؟
v2,D03_47,deep_03,47,Someone dismisses your idea rudely. What do you do?,شخص يقلل من فكرتك بفظاظة. ماذا تفعل؟
v2,D03_48,deep_03,48,You see unequal treatment in a team. What do you do?,ترى معاملة غير متساوية في فريق. ماذا تفعل؟
v2,D04_01,deep_04,1,You notice your mother/father is stressed today. What do you do?,تلاحظ أن والدك/والدتك متوتر اليوم. ماذا تفعل؟
v2,D04_02,deep_04,2,Your to-do list is too long for one day. What do you do?,قائمة مهامك أطول من يوم واحد. ماذا تفعل؟
v2,D04_03,deep_04,3,You feel your week is repetitive. What do you change?,تشعر أن أسبوعك متكرر. ماذا تغيّر؟
v2,D04_04,deep_04,4,A friend cancels last minute. What do you do?,صديق يلغي في آخر لحظة. ماذا تفعل؟
v2,D04_05,deep_04,5,You’re offered a flexible role with unclear rules. What do you do?,عُرض عليك دور مرن لكن قواعده غير واضحة. ماذا تفعل؟
v2,D04_06,deep_04,6,You spot a small safety hazard in the hallway. What do you do?,تلاحظ خطر سلامة بسيط في الممر. ماذا تفعل؟
v2,D04_07,deep_04,7,Someone speaks to you sharply in public. What do you do?,شخص يتحدث معك بحدة أمام الناس. ماذا تفعل؟
v2,D04_08,deep_04,8,A teammate is treated unfairly. What do you do?,زميل يُعامل بظلم. ماذا تفعل؟
v2,D04_09,deep_04,9,You want to strengthen a friendship. What’s your step?,تريد تقوية صداقة. ما خطوتك؟
v2,D04_10,deep_04,10,You want to learn faster for work/study. What do you do?,تريد التعلم أسرع للعمل/الدراسة. ماذا تفعل؟
v2,D04_11,deep_04,11,You feel you’re busy but not fulfilled. What do you do?,تشعر أنك مشغول لكن غير مُشبَع. ماذا تفعل؟
v2,D04_12,deep_04,12,Your bills surprise you this month. What do you do?,فواتيرك فاجأتك هذا الشهر. ماذا تفعل؟
v2,D04_13,deep_04,13,You delivered results but got no feedback. What do you do?,قدمت نتائج ولم تحصل على ملاحظات. ماذا تفعل؟
v2,D04_14,deep_04,14,A new experience is available but you’re unsure. What do you do?,تجربة جديدة متاحة لكنك غير متأكد. ماذا تفعل؟
v2,D04_15,deep_04,15,You want to express yourself after pressure. What do you do?,تريد التعبير عن نفسك بعد ضغط. ماذا تفعل؟
v2,D04_16,deep_04,16,You need a quick mood reset. What do you choose?,تحتاج إعادة ضبط سريعة للمزاج. ماذا تختار؟
v2,D04_17,deep_04,17,Your building plans a clean-up day. What do you do?,المبنى يخطط ليوم تنظيف. ماذا تفعل؟
v2,D04_18,deep_04,18,You’re thinking about your next 6 months. What do you focus on?,تفكر في الستة أشهر القادمة. على ماذا تركز؟
v2,D04_19,deep_04,19,Someone supported you quietly. How do you respond?,شخص دعمك بهدوء. كيف ترد؟
v2,D04_20,deep_04,20,You feel close to burnout. What do you do first?,تشعر بقرب الإرهاق. ماذا تفعل أولًا؟
v2,D04_21,deep_04,21,A family request conflicts with your plan. What do you do?,طلب عائلي يتعارض مع خطتك. ماذا تفعل؟
v2,D04_22,deep_04,22,You have a free evening unexpectedly. What do you do?,لديك مساء فارغ فجأة. ماذا تفعل؟
v2,D04_23,deep_04,23,You want more independence in your schedule. What do you do?,تريد استقلالية أكثر في جدولك. ماذا تفعل؟
v2,D04_24,deep_04,24,People ignore a shared rule in the office. What do you do?,الناس يتجاهلون قاعدة مشتركة في المكتب. ماذا تفعل؟
v2,D04_25,deep_04,25,You want a habit to last. What do you try?,تريد عادة تستمر. ماذا تجرب؟
v2,D04_26,deep_04,26,You feel tension in your body. What helps first?,تشعر بتوتر في جسدك. ما الذي يساعد أولًا؟
v2,D04_27,deep_04,27,A colleague interrupts you repeatedly. What do you do?,زميل يقاطعك مرارًا. ماذا تفعل؟
v2,D04_28,deep_04,28,Two friends ask you to mediate. What do you do?,صديقان يطلبان منك الوساطة. ماذا تفعل؟
v2,D04_29,deep_04,29,A friend wants to talk but you’re drained. What do you do?,صديق يريد الحديث وأنت مُنهك. ماذا تفعل؟
v2,D04_30,deep_04,30,You want to upgrade your skills this month. What do you pick?,تريد تطوير مهاراتك هذا الشهر. ماذا تختار؟
v2,D04_31,deep_04,31,You feel your inner life is noisy. What do you do?,تشعر أن داخلك مزدحم. ماذا تفعل؟
v2,D04_32,deep_04,32,You want more financial stability. What do you do?,تريد استقرارًا ماليًا أكبر. ماذا تفعل؟
v2,D04_33,deep_04,33,You want your effort to be seen fairly. What do you do?,تريد أن يُرى جهدك بإنصاف. ماذا تفعل؟
v2,D04_34,deep_04,34,You get invited to try something new alone. What do you do?,دُعيت لتجربة شيء جديد وحدك. ماذا تفعل؟
v2,D04_35,deep_04,35,Your room feels dull. What do you do?,غرفتك تبدو باهتة. ماذا تفعل؟
v2,D04_36,deep_04,36,You have 30 minutes break. What do you do?,لديك استراحة 30 دقيقة. ماذا تفعل؟
v2,D04_37,deep_04,37,A neighbor asks for help organizing something. What do you do?,جار يطلب مساعدتك في تنظيم أمر ما. ماذا تفعل؟
v2,D04_38,deep_04,38,You want to push your ambition without stress. What do you do?,تريد دفع طموحك دون ضغط زائد. ماذا تفعل؟
v2,D04_39,deep_04,39,Someone praises you publicly. What do you do?,شخص يمدحك علنًا. ماذا تفعل؟
v2,D04_40,deep_04,40,Your work-life boundary is slipping. What do you do?,حدود عملك وحياتك تتراجع. ماذا تفعل؟
v2,D04_41,deep_04,41,You notice someone at work seems isolated. What do you do?,تلاحظ أن شخصًا في العمل يبدو معزولًا. ماذا تفعل؟
v2,D04_42,deep_04,42,You must deliver under pressure and limited time. What do you do?,يجب أن تُسلّم تحت ضغط ووقت محدود. ماذا تفعل؟
v2,D04_43,deep_04,43,You want more joy in daily life. What do you do?,تريد فرحًا أكثر في الحياة اليومية. ماذا تفعل؟
v2,D04_44,deep_04,44,You need to make a personal choice. What guides you?,تحتاج لاتخاذ خيار شخصي. ما الذي يوجهك؟
v2,D04_45,deep_04,45,A safety incident almost happens. What do you do?,كاد يحدث حادث سلامة. ماذا تفعل؟
v2,D04_46,deep_04,46,You want to feel healthier this week. What’s your start?,تريد أن تشعر بصحة أفضل هذا الأسبوع. ما بدايتك؟
v2,D04_47,deep_04,47,Someone mocks your opinion. What do you do?,شخص يسخر من رأيك. ماذا تفعل؟
v2,D04_48,deep_04,48,You notice unequal opportunities in a team. What do you do?,تلاحظ فرصًا غير متساوية في فريق. ماذا تفعل؟
v2,D05_01,deep_05,1,You notice your spouse/parent looks exhausted after work. What do you do?,تلاحظ أن شريكك/أحد والديك مرهق بعد العمل. ماذا تفعل؟
v2,D05_02,deep_05,2,You have an important deadline and distractions keep coming. What do you do?,لديك موعد تسليم مهم وتأتيك مشتتات متكررة. ماذا تفعل؟
v2,D05_03,deep_05,3,You feel your days are missing joy. What do you add?,تشعر أن أيامك تفتقد الفرح. ماذا تضيف؟
v2,D05_04,deep_05,4,A friend shares a personal struggle. How do you respond?,صديق يشاركك معاناة شخصية. كيف ترد؟
v2,D05_05,deep_05,5,You’re offered a flexible opportunity but it’s unclear. What do you do?,عُرضت عليك فرصة مرنة لكنها غير واضحة. ماذا تفعل؟
v2,D05_06,deep_05,6,You notice a safety concern in your routine (door, cable, etc.). What do you do?,تلاحظ أمرًا يخص السلامة في روتينك (باب/سلك...). ماذا تفعل؟
v2,D05_07,deep_05,7,Someone jokes about you in a way that feels disrespectful. What do you do?,شخص يمزح عنك بطريقة تشعرك بعدم الاحترام. ماذا تفعل؟
v2,D05_08,deep_05,8,A teammate gets credit for your contribution. What do you do?,زميل يحصل على الفضل بدلًا منك. ماذا تفعل؟
v2,D05_09,deep_05,9,A close friend seems distant lately. What do you do?,صديق مقرّب يبدو بعيدًا مؤخرًا. ماذا تفعل؟
v2,D05_10,deep_05,10,You want to build a new skill. How do you start?,تريد بناء مهارة جديدة. كيف تبدأ؟
v2,D05_11,deep_05,11,You feel busy but not grounded. What do you do?,تشعر بالانشغال لكن دون ثبات داخلي. ماذا تفعل؟
v2,D05_12,deep_05,12,An unexpected bill shows up. What do you do?,ظهرت فاتورة غير متوقعة. ماذا تفعل؟
v2,D05_13,deep_05,13,You did good work but it wasn’t noticed. What do you do?,قدمت عملًا جيدًا ولم يلاحظه أحد. ماذا تفعل؟
v2,D05_14,deep_05,14,You’re invited to a new experience that feels uncertain. What do you do?,دُعيت لتجربة جديدة تبدو غير مؤكدة. ماذا تفعل؟
v2,D05_15,deep_05,15,You want to express yourself after pressure. What do you do?,تريد التعبير عن نفسك بعد ضغط. ماذا تفعل؟
v2,D05_16,deep_05,16,You need a quick reset after a stressful day. What do you do?,تحتاج إعادة ضبط سريعة بعد يوم مرهق. ماذا تفعل؟
v2,D05_17,deep_05,17,Your neighborhood plans a small volunteer task. What do you do?,الحي يخطط لمهمة تطوعية صغيرة. ماذا تفعل؟
v2,D05_18,deep_05,18,You’re thinking about your next year. What do you focus on?,تفكر في عامك القادم. على ماذا تركز؟
v2,D05_19,deep_05,19,Someone helped you quietly. How do you respond?,شخص ساعدك بهدوء. كيف ترد؟
v2,D05_20,deep_05,20,You’ve been overworking for weeks. What do you change?,تعمل فوق طاقتك منذ أسابيع. ماذا تغيّر؟
v2,D05_21,deep_05,21,A family request comes during your busiest day. What do you do?,طلب عائلي يأتي في أكثر أيامك انشغالًا. ماذا تفعل؟
v2,D05_22,deep_05,22,You finish early and feel you should “use the time well.” What do you do?,تنهي مبكرًا وتشعر أنك يجب أن “تستفيد من الوقت”. ماذا تفعل؟
v2,D05_23,deep_05,23,You want more independence in how you work/live. What do you do?,تريد استقلالية أكبر في طريقة عملك/حياتك. ماذا تفعل؟
v2,D05_24,deep_05,24,A shared rule is ignored and affects everyone. What do you do?,قاعدة مشتركة تُتجاهل وتؤثر على الجميع. ماذا تفعل؟
v2,D05_25,deep_05,25,You’re starting a habit and fear you’ll quit. What helps?,تبدأ عادة وتخاف أن تتوقف. ما الذي يساعد؟
v2,D05_26,deep_05,26,You feel low energy today. What do you do first?,تشعر بانخفاض الطاقة اليوم. ماذا تفعل أولًا؟
v2,D05_27,deep_05,27,Someone interrupts you repeatedly in a meeting. What do you do?,شخص يقاطعك مرارًا في اجتماع. ماذا تفعل؟
v2,D05_28,deep_05,28,Two friends disagree and ask you to mediate. What do you do?,صديقان يختلفان ويطلبان منك الوساطة. ماذا تفعل؟
v2,D05_29,deep_05,29,A friend wants to meet, but your schedule is packed. What do you do?,صديق يريد اللقاء لكن جدولك ممتلئ. ماذا تفعل؟
v2,D05_30,deep_05,30,You want to study more effectively. What do you do?,تريد الدراسة بفعالية أكبر. ماذا تفعل؟
v2,D05_31,deep_05,31,You feel your inner life is noisy. What helps you reset?,تشعر أن داخلك مزدحم. ما الذي يساعدك على إعادة الضبط؟
v2,D05_32,deep_05,32,You want more financial stability. What do you do?,تريد استقرارًا ماليًا أكبر. ماذا تفعل؟
v2,D05_33,deep_05,33,You want fair recognition for your effort. What do you do?,تريد تقديرًا منصفًا لجهدك. ماذا تفعل؟
v2,D05_34,deep_05,34,You can try a new activity, but it’s outside your comfort zone. What do you do?,يمكنك تجربة نشاط جديد لكنه خارج منطقة راحتك. ماذا تفعل؟
v2,D05_35,deep_05,35,Your space feels dull. What do you do?,مساحتك تبدو باهتة. ماذا تفعل؟
v2,D05_36,deep_05,36,You have one free hour today. What do you choose?,لديك ساعة فراغ اليوم. ماذا تختار؟
v2,D05_37,deep_05,37,A community issue needs coordination. What do you do?,قضية مجتمعية تحتاج تنسيقًا. ماذا تفعل؟
v2,D05_38,deep_05,38,You want to push your ambition without burning out. What do you do?,تريد دفع طموحك دون إرهاق. ماذا تفعل؟
v2,D05_39,deep_05,39,Someone praises you publicly. What do you do?,شخص يمدحك علنًا. ماذا تفعل؟
v2,D05_40,deep_05,40,Your work-life boundary is slipping. What do you do?,حدود العمل والحياة تتراجع. ماذا تفعل؟
v2,D05_41,deep_05,41,You notice someone at work seems isolated. What do you do?,تلاحظ أن شخصًا في العمل يبدو معزولًا. ماذا تفعل؟
v2,D05_42,deep_05,42,You must deliver results under pressure and limited time. What do you do?,يجب أن تُسلّم نتائج تحت ضغط ووقت محدود. ماذا تفعل؟
v2,D05_43,deep_05,43,You want more joy in daily life. What do you do?,تريد فرحًا أكثر في الحياة اليومية. ماذا تفعل؟
v2,D05_44,deep_05,44,You need to make a personal decision. What guides you?,تحتاج لاتخاذ قرار شخصي. ما الذي يوجهك؟
v2,D05_45,deep_05,45,A safety concern is raised by someone. What do you do?,أثار أحدهم قلقًا يتعلق بالسلامة. ماذا تفعل؟
v2,D05_46,deep_05,46,You want to feel healthier this week. What’s your start?,تريد أن تشعر بصحة أفضل هذا الأسبوع. ما بدايتك؟
v2,D05_47,deep_05,47,Someone dismisses your idea rudely. What do you do?,شخص يقلل من فكرتك بفظاظة. ماذا تفعل؟
v2,D05_48,deep_05,48,You see unequal opportunities in a group. What do you do?,ترى فرصًا غير متساوية في مجموعة. ماذا تفعل؟
v2,D06_01,deep_06,1,Your partner feels emotionally distant this week,شريكك يبدو بعيدًا عاطفيًا هذا الأسبوع
v2,D06_02,deep_06,2,A senior at work takes credit for your idea,شخص أقدم في العمل يأخذ الفضل لفكرتك
v2,D06_03,deep_06,3,You keep postponing an important health check,تؤجل فحصًا صحيًا مهمًا باستمرار
v2,D06_04,deep_06,4,You notice rising tension with a close friend,تلاحظ توترًا متزايدًا مع صديق مقرّب
v2,D06_05,deep_06,5,A new role offers growth but demands travel,دور جديد يقدم نموًا لكنه يتطلب سفرًا
v2,D06_06,deep_06,6,Your monthly spending is higher than expected,إنفاقك الشهري أعلى من المتوقع
v2,D06_07,deep_06,7,You feel your days lack meaning lately,تشعر أن أيامك تفتقد المعنى مؤخرًا
v2,D06_08,deep_06,8,A family member keeps crossing your boundaries,أحد أفراد العائلة يتجاوز حدودك باستمرار
v2,D06_09,deep_06,9,You discover a safety issue in your building,تكتشف مشكلة سلامة في مبناك
v2,D06_10,deep_06,10,You want to rebuild your routine after a messy month,تريد إعادة بناء روتينك بعد شهر فوضوي
v2,D06_11,deep_06,11,A colleague asks you to cover their mistakes,زميل يطلب منك تغطية أخطائه
v2,D06_12,deep_06,12,You feel invisible in your team meetings,تشعر أنك غير مرئي في اجتماعات الفريق
v2,D06_13,deep_06,13,Your home feels heavy and uninspiring,منزلك يبدو ثقيلًا وغير ملهم
v2,D06_14,deep_06,14,A neighbor hints they need help but feels shy,جار يلمح أنه يحتاج مساعدة لكنه يستحي
v2,D06_15,deep_06,15,You have a chance to learn a skill that can change your path,لديك فرصة لتعلم مهارة قد تغيّر مسارك
v2,D06_16,deep_06,16,You are offered a quick shortcut that feels unfair,عُرض عليك اختصار سريع لكنه يبدو غير عادل
v2,D06_17,deep_06,17,You want more joy without spending more money,تريد فرحًا أكثر دون إنفاق إضافي
v2,D06_18,deep_06,18,A friend wants daily contact and you feel overwhelmed,صديق يريد تواصلًا يوميًا وأنت تشعر بالإرهاق
v2,D06_19,deep_06,19,You receive criticism in front of others,تتلقى نقدًا أمام الآخرين
v2,D06_20,deep_06,20,You are deciding whether to move to a new place,تقرر إن كنت ستنتقل إلى مكان جديد
v2,D06_21,deep_06,21,You keep saying yes and your calendar is full,تقول نعم دائمًا وجدولك ممتلئ
v2,D06_22,deep_06,22,You want to start a side project after work,تريد بدء مشروع جانبي بعد العمل
v2,D06_23,deep_06,23,A family disagreement needs someone to mediate,خلاف عائلي يحتاج من يتوسط
v2,D06_24,deep_06,24,You notice gossip harming someone in your circle,تلاحظ نميمة تضر شخصًا في دائرتك
v2,D06_25,deep_06,25,You feel your body needs recovery not pressure,تشعر أن جسدك يحتاج تعافيًا لا ضغطًا
v2,D06_26,deep_06,26,You want to be more consistent with learning,تريد أن تكون أكثر ثباتًا في التعلم
v2,D06_27,deep_06,27,Your finances are stable but you feel no security,وضعك المالي مستقر لكنك لا تشعر بالأمان
v2,D06_28,deep_06,28,You miss your community and feel isolated,تفتقد مجتمعك وتشعر بالعزلة
v2,D06_29,deep_06,29,A team decision ignores your input repeatedly,قرار الفريق يتجاهل رأيك مرارًا
v2,D06_30,deep_06,30,You are invited to an event that clashes with your values,دُعيت لفعالية تتعارض مع قيمك
v2,D06_31,deep_06,31,You want to express creativity but you feel blocked,تريد التعبير الإبداعي لكنك تشعر بالانسداد
v2,D06_32,deep_06,32,You have a free day and feel guilty resting,لديك يوم فراغ وتشعر بالذنب إن ارتحت
v2,D06_33,deep_06,33,A friend asks for a loan and you are unsure,صديق يطلب قرضًا وأنت متردد
v2,D06_34,deep_06,34,A new habit starts well then fades in week two,عادة جديدة تبدأ جيدًا ثم تضعف في الأسبوع الثاني
v2,D06_35,deep_06,35,You want to take a risk but fear the consequences,تريد المخاطرة لكنك تخاف العواقب
v2,D06_36,deep_06,36,Your friend group plans a trip with poor planning,مجموعة الأصدقاء تخطط لرحلة بتخطيط ضعيف
v2,D06_37,deep_06,37,You want more respect at work without conflict,تريد احترامًا أكثر في العمل دون صدام
v2,D06_38,deep_06,38,A community project needs coordination and follow through,مشروع مجتمعي يحتاج تنسيقًا ومتابعة
v2,D06_39,deep_06,39,You achieve something big and feel empty after,تحقق إنجازًا كبيرًا ثم تشعر بالفراغ
v2,D06_40,deep_06,40,You want to improve your work life balance this month,تريد تحسين توازن العمل والحياة هذا الشهر
v2,D06_41,deep_06,41,You keep comparing yourself to others online,تستمر في مقارنة نفسك بالآخرين عبر الإنترنت
v2,D06_42,deep_06,42,You notice someone new in the team feels excluded,تلاحظ شخصًا جديدًا في الفريق يشعر بالإقصاء
v2,D06_43,deep_06,43,A close person is disappointed in you,شخص قريب منك يشعر بخيبة أمل تجاهك
v2,D06_44,deep_06,44,You are choosing between a safe path and a bold path,تختار بين مسار آمن ومسار جريء
v2,D06_45,deep_06,45,A small mistake could become a bigger risk if ignored,خطأ صغير قد يتحول لخطر أكبر إن تُرك
v2,D06_46,deep_06,46,You want to reduce stress without losing performance,تريد تقليل الضغط دون خسارة الأداء
v2,D06_47,deep_06,47,You receive unexpected praise from someone you respect,تتلقى مدحًا غير متوقع من شخص تحترمه
v2,D06_48,deep_06,48,You want to end the day with calm not scrolling,تريد إنهاء اليوم بهدوء لا بتصفح
v2,D07_01,deep_07,1,Your partner asks for more time together,شريكك يطلب وقتًا أكثر معًا
v2,D07_02,deep_07,2,A manager praises you privately but not publicly,مديرك يمدحك على انفراد دون إعلان
v2,D07_03,deep_07,3,You feel your health habits are slipping,تشعر أن عاداتك الصحية تتراجع
v2,D07_04,deep_07,4,A close friend avoids talking about an issue,صديق مقرّب يتجنب الحديث عن مشكلة
v2,D07_05,deep_07,5,You are offered a role with autonomy and risk,عُرض عليك دور باستقلالية لكنه يحمل مخاطرة
v2,D07_06,deep_07,6,You notice repeated small expenses add up,تلاحظ أن مصاريف صغيرة متكررة تتراكم
v2,D07_07,deep_07,7,You feel disconnected from inner calm,تشعر بانفصال عن السكينة الداخلية
v2,D07_08,deep_07,8,A family member expects access to your time anytime,فرد من العائلة يتوقع إتاحة وقتك في أي وقت
v2,D07_09,deep_07,9,You see a safety hazard near children in your area,ترى خطر سلامة قرب الأطفال في منطقتك
v2,D07_10,deep_07,10,Your week lacks structure and you feel scattered,أسبوعك بلا هيكلة وتشعر بالتشتت
v2,D07_11,deep_07,11,A colleague asks you to bend a rule to save time,زميل يطلب منك تجاوز قاعدة لتوفير الوقت
v2,D07_12,deep_07,12,In meetings your ideas are ignored until repeated,في الاجتماعات تُهمل أفكارك حتى يكررها غيرك
v2,D07_13,deep_07,13,Your home feels noisy and stressful,منزلك يبدو صاخبًا ومجهدًا
v2,D07_14,deep_07,14,A neighbor is new and looks isolated,جار جديد يبدو معزولًا
v2,D07_15,deep_07,15,A course could upgrade your career but needs discipline,دورة قد ترفع مستواك المهني لكنها تحتاج انضباطًا
v2,D07_16,deep_07,16,You witness someone being treated unfairly in a group,تشهد معاملة غير عادلة لشخص في مجموعة
v2,D07_17,deep_07,17,You want joy without relying on screens,تريد فرحًا دون الاعتماد على الشاشات
v2,D07_18,deep_07,18,A friend sends long voice notes every day,صديق يرسل رسائل صوتية طويلة يوميًا
v2,D07_19,deep_07,19,You receive harsh feedback from a client,تتلقى ملاحظة قاسية من عميل
v2,D07_20,deep_07,20,You are deciding whether to buy something expensive,تفكر في شراء شيء مكلف
v2,D07_21,deep_07,21,Your calendar is full and you feel trapped,جدولك ممتلئ وتشعر أنك محاصر
v2,D07_22,deep_07,22,You want a side project but fear failure,تريد مشروعًا جانبيًا لكن تخاف الفشل
v2,D07_23,deep_07,23,Two family members argue and expect your support,شخصان من العائلة يختلفان ويتوقعان دعمك
v2,D07_24,deep_07,24,Gossip spreads about someone you know,تنتشر نميمة عن شخص تعرفه
v2,D07_25,deep_07,25,Your body feels tired and you still push,جسدك متعب وأنت تواصل الضغط
