version_id,scenario_code,scenario_set_code,order_index,scenario_text_en,scenario_text_ar
v2,D07_26,deep_07,26,You want a learning routine that sticks,تريد روتين تعلم يستمر
v2,D07_27,deep_07,27,You earn well but still worry about money,دخلك جيد لكنك تقلق ماليًا
v2,D07_28,deep_07,28,You want to feel part of a community again,تريد الشعور بالانتماء لمجتمع مجددًا
v2,D07_29,deep_07,29,A repeated decision harms the team and no one speaks,قرار متكرر يضر الفريق ولا أحد يتكلم
v2,D07_30,deep_07,30,An invitation conflicts with your priorities,دعوة تتعارض مع أولوياتك
v2,D07_31,deep_07,31,You want to express yourself creatively this month,تريد التعبير الإبداعي هذا الشهر
v2,D07_32,deep_07,32,You have a free day and feel pressure to be productive,لديك يوم فراغ وتشعر بضغط للإنتاج
v2,D07_33,deep_07,33,A friend asks for money and you feel uneasy,صديق يطلب مالًا وتشعر بعدم ارتياح
v2,D07_34,deep_07,34,Your new habit drops after one stressful week,عادتك الجديدة تتوقف بعد أسبوع ضاغط
v2,D07_35,deep_07,35,You consider a bold move that could change your path,تفكر بخطوة جريئة قد تغيّر مسارك
v2,D07_36,deep_07,36,Friends plan a trip with unclear roles and costs,الأصدقاء يخططون لرحلة دون وضوح أدوار وتكاليف
v2,D07_37,deep_07,37,You want more respect at work without drama,تريد احترامًا أكثر في العمل دون دراما
v2,D07_38,deep_07,38,A volunteer effort needs someone to organize follow up,جهد تطوعي يحتاج من ينظم المتابعة
v2,D07_39,deep_07,39,After success you feel no satisfaction,بعد النجاح لا تشعر بالرضا
v2,D07_40,deep_07,40,Work is leaking into your evenings,العمل يتسرب إلى أمسياتك
v2,D07_41,deep_07,41,Online comparison makes you feel behind,المقارنة عبر الإنترنت تجعلك تشعر أنك متأخر
v2,D07_42,deep_07,42,A new teammate struggles to fit in,زميل جديد يجد صعوبة في الاندماج
v2,D07_43,deep_07,43,Someone close feels hurt by your absence,شخص قريب تأذى من غيابك
v2,D07_44,deep_07,44,You must choose between safety and growth,عليك الاختيار بين الأمان والنمو
v2,D07_45,deep_07,45,A small mistake could become a bigger risk,خطأ صغير قد يتحول لخطر أكبر
v2,D07_46,deep_07,46,You want less stress without losing results,تريد ضغطًا أقل دون خسارة النتائج
v2,D07_47,deep_07,47,You get public praise and feel awkward,تحصل على مدح علني وتشعر بالحرج
v2,D07_48,deep_07,48,You want to end the day with calm and presence,تريد إنهاء اليوم بهدوء وحضور
v2,D08_01,deep_08,1,Your partner asks for reassurance after a hard week,شريكك يطلب طمأنة بعد أسبوع صعب
v2,D08_02,deep_08,2,A friend says you have been distant lately,صديق يقول إنك كنت بعيدًا مؤخرًا
v2,D08_03,deep_08,3,A family member expects constant availability,أحد أفراد العائلة يتوقع إتاحتك دائمًا
v2,D08_04,deep_08,4,A colleague pushes you to rush and skip steps,زميل يدفعك للاستعجال وتجاوز الخطوات
v2,D08_05,deep_08,5,You notice your sleep is getting worse,تلاحظ أن نومك يزداد سوءًا
v2,D08_06,deep_08,6,You feel stuck in the same routine for weeks,تشعر أنك عالق في نفس الروتين لأسابيع
v2,D08_07,deep_08,7,A manager asks you to take on extra work without clarity,مدير يطلب منك عملًا إضافيًا دون وضوح
v2,D08_08,deep_08,8,Someone makes a joke that crosses the line,شخص يمزح بطريقة تتجاوز الحد
v2,D08_09,deep_08,9,You see unfair treatment in a group discussion,ترى معاملة غير عادلة في نقاش جماعي
v2,D08_10,deep_08,10,A neighbor asks for help but you are overloaded,جار يطلب مساعدة وأنت مثقل
v2,D08_11,deep_08,11,Your monthly expenses are drifting upward,مصاريفك الشهرية تتجه للارتفاع
v2,D08_12,deep_08,12,You receive public praise and feel uneasy,تتلقى مدحًا علنيًا وتشعر بعدم ارتياح
v2,D08_13,deep_08,13,You want to learn a skill that improves your career,تريد تعلم مهارة تحسن مسارك المهني
v2,D08_14,deep_08,14,You feel your work has no meaning lately,تشعر أن عملك بلا معنى مؤخرًا
v2,D08_15,deep_08,15,A friend invites you to try something new,صديق يدعوك لتجربة شيء جديد
v2,D08_16,deep_08,16,You keep postponing an important decision,تؤجل قرارًا مهمًا باستمرار
v2,D08_17,deep_08,17,Your home feels cluttered and heavy,منزلك يبدو مزدحمًا وثقيلًا
v2,D08_18,deep_08,18,You want more joy without spending money,تريد فرحًا أكثر دون إنفاق
v2,D08_19,deep_08,19,A close person is disappointed in you,شخص قريب يشعر بخيبة أمل منك
v2,D08_20,deep_08,20,You are offered a higher salary with higher risk,عُرض عليك راتب أعلى مع مخاطرة أعلى
v2,D08_21,deep_08,21,You feel your week is full but not balanced,تشعر أن أسبوعك ممتلئ لكنه غير متوازن
v2,D08_22,deep_08,22,A friend asks for a loan and you are unsure,صديق يطلب قرضًا وأنت متردد
v2,D08_23,deep_08,23,You notice a safety hazard in a shared space,تلاحظ خطر سلامة في مساحة مشتركة
v2,D08_24,deep_08,24,People keep arriving late and it affects the team,الناس يتأخرون باستمرار ويؤثر ذلك على الفريق
v2,D08_25,deep_08,25,You want recognition but dislike asking for it,تريد تقديرًا لكنك لا تحب طلبه
v2,D08_26,deep_08,26,You feel your body needs recovery not pressure,تشعر أن جسدك يحتاج تعافيًا لا ضغطًا
v2,D08_27,deep_08,27,You want more independence in your schedule,تريد استقلالية أكثر في جدولك
v2,D08_28,deep_08,28,A community initiative needs volunteers,مبادرة مجتمعية تحتاج متطوعين
v2,D08_29,deep_08,29,You keep comparing yourself to others online,تستمر في مقارنة نفسك بالآخرين عبر الإنترنت
v2,D08_30,deep_08,30,A teammate takes your idea and presents it as theirs,زميل يأخذ فكرتك ويعرضها كأنها له
v2,D08_31,deep_08,31,You want to deepen your inner calm,تريد تعميق السكينة الداخلية
v2,D08_32,deep_08,32,You have a free evening and feel guilty resting,لديك مساء فارغ وتشعر بالذنب إن ارتحت
v2,D08_33,deep_08,33,Two friends expect you to choose a side,صديقان يتوقعان منك اختيار طرف
v2,D08_34,deep_08,34,You consider moving to a new neighborhood,تفكر في الانتقال إلى حي جديد
v2,D08_35,deep_08,35,You want to take a risk that could change your path,تريد مخاطرة قد تغيّر مسارك
v2,D08_36,deep_08,36,You want a habit that lasts beyond week one,تريد عادة تستمر بعد الأسبوع الأول
v2,D08_37,deep_08,37,Your team needs a clear plan for a complex task,فريقك يحتاج خطة واضحة لمهمة معقدة
v2,D08_38,deep_08,38,You notice someone new feels excluded,تلاحظ أن شخصًا جديدًا يشعر بالإقصاء
v2,D08_39,deep_08,39,You achieve a goal but feel empty after,تحقق هدفًا ثم تشعر بالفراغ
v2,D08_40,deep_08,40,Work is leaking into your personal time,العمل يتسرب إلى وقتك الشخصي
v2,D08_41,deep_08,41,You want to express creativity but feel blocked,تريد التعبير الإبداعي لكنك تشعر بالانسداد
v2,D08_42,deep_08,42,A friend cancels repeatedly and it hurts,صديق يلغي مرارًا وهذا يؤلمك
v2,D08_43,deep_08,43,You face a choice between fairness and convenience,تواجه خيارًا بين العدل والسهولة
v2,D08_44,deep_08,44,Your spending is stable but you still feel insecure,إنفاقك مستقر لكنك ما زلت تشعر بعدم الأمان
v2,D08_45,deep_08,45,A small mistake could become a bigger risk,خطأ صغير قد يتحول لخطر أكبر
v2,D08_46,deep_08,46,You want less stress without losing results,تريد ضغطًا أقل دون خسارة النتائج
v2,D08_47,deep_08,47,Someone questions your competence in front of others,شخص يشكك في كفاءتك أمام الآخرين
v2,D08_48,deep_08,48,You want to end the day with calm and presence,تريد إنهاء اليوم بهدوء وحضور
v2,D09_01,deep_09,1,Trust feels weaker after a small lie,الثقة تضعف بعد كذبة صغيرة
v2,D09_02,deep_09,2,You are overlooked for a visible project,تم تجاهلك في مشروع ظاهر
v2,D09_03,deep_09,3,Your body signals stress more often,جسدك يعطي إشارات ضغط أكثر
v2,D09_04,deep_09,4,A friend only calls when they need something,صديق لا يتصل إلا عند الحاجة
v2,D09_05,deep_09,5,A new job offer promises growth but uncertainty,عرض عمل جديد يعد بالنمو لكنه غير مؤكد
v2,D09_06,deep_09,6,Money feels tight despite stable income,المال يبدو ضيقًا رغم دخل ثابت
v2,D09_07,deep_09,7,You want a clearer inner direction,تريد اتجاهًا داخليًا أوضح
v2,D09_08,deep_09,8,A relative speaks for you in public,قريب يتحدث نيابة عنك أمام الناس
v2,D09_09,deep_09,9,You notice repeated safety neglect at home,تلاحظ إهمال سلامة متكرر في المنزل
v2,D09_10,deep_09,10,Your routine collapses after one busy week,روتينك ينهار بعد أسبوع مزدحم
v2,D09_11,deep_09,11,A colleague asks you to hide a mistake,زميل يطلب منك إخفاء خطأ
v2,D09_12,deep_09,12,Your idea is ignored then accepted when repeated,فكرتك تُهمل ثم تُقبل حين يكررها غيرك
v2,D09_13,deep_09,13,Home feels empty and cold,البيت يبدو فارغًا وباردًا
v2,D09_14,deep_09,14,A neighbor seems lonely but proud,جار يبدو وحيدًا لكنه معتد بنفسه
v2,D09_15,deep_09,15,A skill gap blocks your next step,فجوة مهارية تعيق خطوتك التالية
v2,D09_16,deep_09,16,You witness unfair distribution of opportunities,تشهد توزيعًا غير عادل للفرص
v2,D09_17,deep_09,17,Joy is missing from your evenings,الفرح غائب عن أمسياتك
v2,D09_18,deep_09,18,A friend sends intense messages late at night,صديق يرسل رسائل مكثفة ليلًا
v2,D09_19,deep_09,19,You receive criticism that feels personal,تتلقى نقدًا يبدو شخصيًا
v2,D09_20,deep_09,20,Choosing whether to relocate for work,تختار إن كنت ستنتقل من أجل العمل
v2,D09_21,deep_09,21,You feel trapped by obligations you accepted,تشعر أنك محاصر بالتزامات قبلتها
v2,D09_22,deep_09,22,Starting a side project after a long day,بدء مشروع جانبي بعد يوم طويل
v2,D09_23,deep_09,23,A family conflict escalates quickly,خلاف عائلي يتصاعد بسرعة
v2,D09_24,deep_09,24,Someone is being mocked in your circle,شخص يتعرض للسخرية في دائرتك
v2,D09_25,deep_09,25,You keep pushing when your body needs rest,تواصل الضغط حين يحتاج جسدك للراحة
v2,D09_26,deep_09,26,Learning goals keep slipping month after month,أهداف التعلم تتأجل شهرًا بعد شهر
v2,D09_27,deep_09,27,You want security without becoming rigid,تريد أمانًا دون أن تصبح جامدًا
v2,D09_28,deep_09,28,You miss belonging in your community,تفتقد الانتماء في مجتمعك
v2,D09_29,deep_09,29,A team choice harms quality and no one objects,قرار فريق يضر الجودة ولا أحد يعترض
v2,D09_30,deep_09,30,An event invitation clashes with your priorities,دعوة لفعالية تتعارض مع أولوياتك
v2,D09_31,deep_09,31,Creativity feels blocked by stress,الإبداع متوقف بسبب الضغط
v2,D09_32,deep_09,32,A free day appears and you feel guilt,يأتي يوم فراغ وتشعر بالذنب
v2,D09_33,deep_09,33,A friend asks for financial help again,صديق يطلب مساعدة مالية مرة أخرى
v2,D09_34,deep_09,34,A habit breaks when travel happens,عادة تنكسر عند السفر
v2,D09_35,deep_09,35,A bold opportunity appears with real risk,فرصة جريئة تظهر مع مخاطرة حقيقية
v2,D09_36,deep_09,36,Friends plan a trip without clear roles,الأصدقاء يخططون لرحلة دون أدوار واضحة
v2,D09_37,deep_09,37,You want respect at work with minimal conflict,تريد احترامًا في العمل بأقل صدام
v2,D09_38,deep_09,38,A volunteer initiative needs consistent follow up,مبادرة تطوعية تحتاج متابعة ثابتة
v2,D09_39,deep_09,39,After a win you feel empty inside,بعد إنجاز تشعر بفراغ داخلي
v2,D09_40,deep_09,40,Work messages invade your personal time,رسائل العمل تتدخل في وقتك الشخصي
v2,D09_41,deep_09,41,Comparison online makes you doubt your path,المقارنة عبر الإنترنت تجعلك تشك بمسارك
v2,D09_42,deep_09,42,A new teammate is left out of the group,زميل جديد مُستبعد من المجموعة
v2,D09_43,deep_09,43,Someone close feels hurt by your choices,شخص قريب تأذى من خياراتك
v2,D09_44,deep_09,44,You must choose between comfort and growth,عليك الاختيار بين الراحة والنمو
v2,D09_45,deep_09,45,A small issue could become a safety risk,مشكلة صغيرة قد تصبح خطر سلامة
v2,D09_46,deep_09,46,Pressure rises and your performance matters,الضغط يرتفع وأداؤك مهم
v2,D09_47,deep_09,47,Public praise comes and you feel exposed,مدح علني يأتي وتشعر بأنك مكشوف
v2,D09_48,deep_09,48,Ending the day with calm feels hard,إنهاء اليوم بهدوء يبدو صعبًا
v2,D10_01,deep_10,1,A small breach of trust appears in a close relationship,يظهر خرق صغير للثقة في علاقة قريبة
v2,D10_02,deep_10,2,Your work contribution is minimized in public,يتم التقليل من مساهمتك في العمل أمام الآخرين
v2,D10_03,deep_10,3,Stress shows up as headaches or tight chest,الضغط يظهر كصداع أو ضيق في الصدر
v2,D10_04,deep_10,4,A friend repeatedly forgets your important days,صديق ينسى مناسباتك المهمة مرارًا
v2,D10_05,deep_10,5,A new opportunity offers growth but unclear expectations,فرصة جديدة تقدم نموًا لكن توقعاتها غير واضحة
v2,D10_06,deep_10,6,You feel finances are stable but not secure,تشعر أن المال مستقر لكنه غير آمن
v2,D10_07,deep_10,7,You feel spiritually dry and distracted,تشعر بجفاف روحي وتشتت
v2,D10_08,deep_10,8,A family member shares your private news,أحد أفراد العائلة يشارك خبرًا خاصًا عنك
v2,D10_09,deep_10,9,You notice a safety risk being ignored at home,تلاحظ خطر سلامة يتم تجاهله في المنزل
v2,D10_10,deep_10,10,Your routine is strong then breaks after travel,روتينك قوي ثم ينكسر بعد السفر
v2,D10_11,deep_10,11,A colleague suggests hiding a mistake to look good,زميل يقترح إخفاء خطأ للظهور بمظهر جيد
v2,D10_12,deep_10,12,Your ideas are heard only when someone else repeats them,أفكارك تُسمع فقط حين يكررها شخص آخر
v2,D10_13,deep_10,13,Home feels cold and without warmth,المنزل يبدو باردًا وبدون دفء
v2,D10_14,deep_10,14,A neighbor seems lonely but avoids help,جار يبدو وحيدًا لكنه يتجنب المساعدة
v2,D10_15,deep_10,15,A learning goal could change your career path,هدف تعلم قد يغير مسارك المهني
v2,D10_16,deep_10,16,You see unequal opportunities in a group,ترى فرصًا غير متساوية في مجموعة
v2,D10_17,deep_10,17,Evenings feel empty and joyless,الأمسيات تبدو فارغة بلا فرح
v2,D10_18,deep_10,18,A friend messages late nightly and expects replies,صديق يراسل ليلًا يوميًا ويتوقع ردًا
v2,D10_19,deep_10,19,You receive feedback that feels humiliating,تتلقى ملاحظة تشعرك بالإهانة
v2,D10_20,deep_10,20,You are deciding whether to relocate for a role,تقرر إن كنت ستنتقل من أجل وظيفة
v2,D10_21,deep_10,21,You feel trapped by commitments you accepted,تشعر أنك محاصر بالتزامات قبلتها
v2,D10_22,deep_10,22,You want a side project but you are exhausted,تريد مشروعًا جانبيًا لكنك مرهق
v2,D10_23,deep_10,23,Family conflict escalates and needs a mediator,خلاف عائلي يتصاعد ويحتاج وسيطًا
v2,D10_24,deep_10,24,Someone is mocked and the room stays silent,شخص يتعرض للسخرية والجميع صامت
v2,D10_25,deep_10,25,Your body asks for recovery but you keep pushing,جسدك يطلب التعافي وأنت تواصل الضغط
v2,D10_26,deep_10,26,Your learning plans keep slipping every month,خطط التعلم تتأجل كل شهر
v2,D10_27,deep_10,27,You want security without losing flexibility,تريد أمانًا دون فقدان المرونة
v2,D10_28,deep_10,28,You miss a sense of belonging,تفتقد شعور الانتماء
v2,D10_29,deep_10,29,A team decision harms quality and no one speaks up,قرار فريق يضر الجودة ولا أحد يتكلم
v2,D10_30,deep_10,30,An invitation clashes with your priorities,دعوة تتعارض مع أولوياتك
v2,D10_31,deep_10,31,Stress blocks your creativity,الضغط يوقف إبداعك
v2,D10_32,deep_10,32,A free day comes and guilt appears,يأتي يوم فراغ ويظهر الذنب
v2,D10_33,deep_10,33,A friend asks again for financial help,صديق يطلب مجددًا مساعدة مالية
v2,D10_34,deep_10,34,A habit breaks when your schedule changes,عادة تنكسر عندما يتغير جدولك
v2,D10_35,deep_10,35,A bold opportunity appears with real risk,فرصة جريئة تظهر مع مخاطرة حقيقية
v2,D10_36,deep_10,36,Friends plan a trip without clear roles and costs,الأصدقاء يخططون لرحلة دون وضوح أدوار وتكاليف
v2,D10_37,deep_10,37,You want respect at work without conflict,تريد احترامًا في العمل دون صدام
v2,D10_38,deep_10,38,A community initiative needs consistent follow up,مبادرة مجتمعية تحتاج متابعة ثابتة
v2,D10_39,deep_10,39,After a big win you feel empty inside,بعد إنجاز كبير تشعر بفراغ داخلي
v2,D10_40,deep_10,40,Work invades your evenings and weekends,العمل يقتحم أمسياتك وعطلاتك
v2,D10_41,deep_10,41,Online comparison makes you doubt your worth,المقارنة عبر الإنترنت تجعلك تشك في قيمتك
v2,D10_42,deep_10,42,A new teammate is left out of the group,زميل جديد يُستبعد من المجموعة
v2,D10_43,deep_10,43,Someone close feels hurt by your absence,شخص قريب تأذى من غيابك
v2,D10_44,deep_10,44,You must choose between comfort and growth,عليك الاختيار بين الراحة والنمو
v2,D10_45,deep_10,45,A small issue could become a safety risk,مشكلة صغيرة قد تصبح خطر سلامة
v2,D10_46,deep_10,46,Pressure rises and performance matters,الضغط يرتفع والأداء مهم
v2,D10_47,deep_10,47,Unexpected praise comes and you feel exposed,مدح غير متوقع يأتي وتشعر بأنك مكشوف
v2,D10_48,deep_10,48,You want to end the day with calm not scrolling,تريد إنهاء اليوم بهدوء لا بتصفح
